### ISSUE TITLE
FreeSWITCH sends blank video packets to conference members when no real video is sent into the conference

### ISSUE THREAD

**Issue by figaro2015** [signalwire/freeswitch#1209]
**Describe the bug**
FreeSWITCH starts sending blank video packets to the conference member(s) as soon as video connection is established, even nobody in the conference is sending video into the conference.

**To Reproduce**
1. Configure MCU video conference.
2. Make WebRTC call from the client into the conference by sharing the client's camera. 
3. Run TCPDUMP, Wireshark, or any other packet tracing/capturing tool to capture video packets in the direction from FreeSWITCH to the client. Use either the source port of the video RTP on the FreeSWITCH side or the destination port of the video RTP on the client side as a filter. Verify video traffic going in both directions.
4. Stop client sharing camera.
5. Observe no video packets flowing from the client to the FreeSWITCH, but there are still video packets flowing from FreeSWITCH to the client's direction.
6. The size of these packets is approximately half of the packets caring real video and depends on the configuration of the canvas in the conference profile. But the frequency of these blank video packets is the same as real video packets.

**Expected behavior**
FreeSWITCH should stop sending video packets to the clients as soon as no real video is been sent into the conference by any of the clients.

**Package version or git hash**
commit 7f86d25c6ca0ba00ba5071fdcb2641af6a39921c (HEAD -> master, origin/master, origin/HEAD)

**Trace logs**
Here is the tcpdump log of the packets with the real video:

14:17:15.995545 IP 192.168.86.37.30424 > 192.168.86.250.62562: UDP, length 1130
14:17:15.995570 IP 192.168.86.37.30424 > 192.168.86.250.62562: UDP, length 1130
14:17:15.995577 IP 192.168.86.37.30424 > 192.168.86.250.62562: UDP, length 1130
14:17:15.995621 IP 192.168.86.37.30424 > 192.168.86.250.62562: UDP, length 1130
14:17:16.048068 IP 192.168.86.37.30424 > 192.168.86.250.62562: UDP, length 1171
14:17:16.048081 IP 192.168.86.37.30424 > 192.168.86.250.62562: UDP, length 1171
14:17:16.048090 IP 192.168.86.37.30424 > 192.168.86.250.62562: UDP, length 1171
14:17:16.048099 IP 192.168.86.37.30424 > 192.168.86.250.62562: UDP, length 1171

And here is the tcpdump of the packets with blank video FreeSWITCH sends when there is no real video sent into the conference:

14:17:17.419068 IP 192.168.86.37.30424 > 192.168.86.250.62562: UDP, length 564
14:17:17.452320 IP 192.168.86.37.30424 > 192.168.86.250.62562: UDP, length 564
14:17:17.479921 IP 192.168.86.37.30424 > 192.168.86.250.62562: UDP, length 564
14:17:17.508206 IP 192.168.86.37.30424 > 192.168.86.250.62562: UDP, length 564
14:17:17.543905 IP 192.168.86.37.30424 > 192.168.86.250.62562: UDP, length 564
14:17:17.561434 IP 192.168.86.37.30424 > 192.168.86.250.62562: UDP, length 156
14:17:17.589214 IP 192.168.86.37.30424 > 192.168.86.250.62562: UDP, length 564
14:17:17.621836 IP 192.168.86.37.30424 > 192.168.86.250.62562: UDP, length 564
14:17:17.649024 IP 192.168.86.37.30424 > 192.168.86.250.62562: UDP, length 564

**Comment by mjerris** [comment]
this is how mux mode works.  it paints an entire screen and sends it.  This can include video elements, files, backgrounds, etc.
