### ISSUE TITLE
No video on one side when using originate command

### ISSUE THREAD

**Issue by tinpotnick** [signalwire/freeswitch#574]
FreeSWITCH Version 1.10.2-release-14-f7bdd3845a~64bit

I have a Yealink T58 and Chrome WebRTC client. When I call from the Yealink to the WebRTC client it works ok.

If I perform an originate command from FS i.e:

1. FS calls the Yealink
2. Yealink answers
3. FS bridges to new call to WebRTC

The video from FS to the WebRTC is a black video. The packet size from FS appears too small - but it is there:

16:38:27.702947 IP 109.169.12.139.12612 > 192.168.0.141.57424: UDP, length 182
16:38:27.720599 IP 192.168.0.141.57424 > 109.169.12.139.12612: UDP, length 182
16:38:27.722531 IP 109.169.12.139.12612 > 192.168.0.141.57424: UDP, length 182
16:38:27.741236 IP 192.168.0.141.57424 > 109.169.12.139.12612: UDP, length 182
16:38:27.747839 IP 109.169.12.139.12612 > 192.168.0.141.57424: UDP, length 182
16:38:27.756470 IP 192.168.0.141.57424 > 109.169.12.139.12612: UDP, length 182
16:38:27.762853 IP 109.169.12.139.12612 > 192.168.0.141.57424: UDP, length 182
16:38:27.776905 IP 192.168.0.141.57424 > 109.169.12.139.12612: UDP, length 182
16:38:27.784158 IP 109.169.12.139.12612 > 192.168.0.141.57424: UDP, length 182
16:38:27.802562 IP 192.168.0.141.57424 > 109.169.12.139.12612: UDP, length 182
16:38:27.802661 IP 109.169.12.139.12612 > 192.168.0.141.57424: UDP, length 182

Compared to a working call:

19:16:08.277680 IP 109.169.12.139.12912 > 192.168.0.141.35276: UDP, length 182
19:16:08.278523 IP 192.168.0.141.50663 > 109.169.12.139.10982: UDP, length 683
19:16:08.283553 IP 192.168.0.141.35276 > 109.169.12.139.12912: UDP, length 182
19:16:08.283682 IP 192.168.0.141.50663 > 109.169.12.139.10982: UDP, length 683
19:16:08.293290 IP 109.169.12.139.12912 > 192.168.0.141.35276: UDP, length 182
19:16:08.303971 IP 192.168.0.141.35276 > 109.169.12.139.12912: UDP, length 182
19:16:08.309301 IP 192.168.0.141.50663 > 109.169.12.139.10982: UDP, length 1067

**Comment by mjerris** [comment]
if you record the call do you get anything?  That would tell you if we are receiving good video or not.  Does it make any difference if its transcoding or not?

**Comment by tinpotnick** [comment]
I have recorded and played back the recording ok (when it is not shown on the far end). So FS receives the video ok.

Both legs are G722 audio and VP8 - so there should be no transcoding. Although I am new to video in FS - so not sure what it does in terms of bridging to video channels - does it alter fps or anything else? If so, how is this controlled?

Will keep looking for now.

**Comment by mjerris** [comment]
if it’s bridged and not transcoding we are not manipulating that video stream it’s basically pass-through (with a bit of rtp header manipulation)... look at connectivity and loss issues of the media from fs to the leg not receiving by comparing pcap at client and server

**Comment by tinpotnick** [comment]
Hi, thanks - I agree. I have spent most of today on it and I agree looks like the issue is elsewhere. I'll close this when I can confirm that. Thanks.

**Comment by tinpotnick** [comment]
I am struggling to figure out what is going on. I feel a little blind when I don't have a tool to peak at VP8 data in an RTP stream or perform some form of analysis. All the port numbers look good. All traffic appears to be going to the right places.

So, I did another test. 2 Zoiper softphones. a calls b. b answers with the video button. a then promotes the call to video. Both sides believe they are in video mode.

b can see remote video. a cannot. Putting a on hold from b and off again gets the video going.

I am still trying to figure out if this is a FS issue or some other networking issue or something else. This is very similar to what I found in the first instance above. If you have any pointers that would be appreciated.

**Comment by tinpotnick** [comment]
Some work later!

I have fully confirmed the RTP streams get set up and are talking. I found the webRTC screen in chrome and have started to figure out the issue with this (but not the solution).

On chrome://webrtc-internals/ Chrome reports pliCount as an ever-increasing number (lost data count).  The decoded frames count remains at 0. So Chrome is receiving the data but there is something wrong with it.

I have yet to figure out how to inspect the VP8 data either in Chrome or by other means. I'll see what I can work out.

**Comment by tinpotnick** [comment]
I have also reproduced this without WebRTC. 

Yealink T58 <--- FS ---> Zoiper

Yealink calls Zoiper - Zoiper answers all connects.
originate on FS - call Yealink then bridge to Zoiper - it works if you answer quickly. If you answer after 20 second you get one-way video (zoiper cannot see video).

I am working on a line of thinking.

When a calls b directly, then a does not setup media until b also has. So a full-frame gets transmitted to b when the call is connected. When you use the originate command then media is set up and running before it is on b - so b misses out on the first full frame.

b should transmit back an FIR request. I am trying to debug this now. So far I cannot find out how it would do this.

Looking in switch_rtp.c it looks like it parses RTP for a "Full INTRA-frame request" but does nothing with it.

I am going to spend more time on this. Hopefully it doesn't turn out I am doing something really stupid. If you could provide any pointers though it would be appreciated.
